{
  "schema_version": "knowledge_policy.v0",
  "policy_id": "POLICY-KNOWLEDGE-ACCESS",
  "version_no": 1,
  "title": "지식 접근과 검색",
  "language": "ko",
  "status": "DRAFT",
  "document_type": "POLICY",
  "access": {
    "access_scope": "STAFF",
    "exposure_policy": "INTERNAL_ONLY",
    "ingest_status": "PENDING"
  },
  "purpose": "직원과 담당자의 접근 범위 및 사례 공개 상태를 검증한다.",
  "rules": [
    {
      "rule_id": "RULE-NEW-ACCESS-SCOPE",
      "priority": 10,
      "trigger": "문의 또는 담당자 업무에 지식 검색이 필요함",
      "agent_action": "허용된 문서와 근거를 제시한다.",
      "final_authority": "SPRING",
      "enforcement": "Spring은 사용자 권한과 지식 공개 범위를 검증한다.",
      "required_evidence": [
        "사용자 권한 문맥",
        "지식 공개 범위"
      ],
      "user_visible_behavior": "공개 가능한 근거만 보여준다.",
      "prohibited_outcomes": [
        "직원에게 담당자 내부 자료 노출",
        "모델의 권한 주장 신뢰"
      ]
    },
    {
      "rule_id": "RULE-NEW-ACCESS-VERSION",
      "priority": 20,
      "trigger": "유사 해결 사례를 제공함",
      "agent_action": "시스템 적용 버전과 조건 및 불확실성을 제시한다.",
      "final_authority": "SPRING",
      "enforcement": "서버는 승인 및 공개 상태를 검사한다.",
      "required_evidence": [
        "사례 버전",
        "적용 조건"
      ],
      "user_visible_behavior": "버전을 모르면 미확인으로 표시한다.",
      "prohibited_outcomes": [
        "버전 자동 적합 보장",
        "유사도만으로 원인 확정"
      ]
    }
  ],
  "prohibitions": [
    "Agent의 실제 시스템 변경·원격 제어",
    "모델 문구만으로 저장·배정·해결 성공 확정"
  ],
  "related_artifacts": {
    "guide_ids": [],
    "runbook_ids": [],
    "scenario_ids": []
  },
  "provenance": {
    "source_policy_ids": [
      "PRD-1.44"
    ],
    "created_at": "2026-10-31"
  },
  "review": {
    "content_status": "AI_DRAFT",
    "reviewer": null,
    "reviewed_at": null,
    "team_review_status": "PENDING"
  }
}
