{
  "schema_version": "knowledge_policy.v0",
  "policy_id": "POLICY-INQUIRY-FLOW",
  "version_no": 1,
  "title": "문의 접수·추가 질문·답변에서 진단 전환 규칙",
  "language": "ko",
  "status": "DRAFT",
  "document_type": "POLICY",
  "access": {"access_scope": "STAFF", "exposure_policy": "INTERNAL_ONLY", "ingest_status": "PENDING"},
  "purpose": "근거 있는 직원 안내와 추가 진단·이관의 경계를 정하고, 복합 문의와 범위 밖 문의를 일관되게 처리한다.",
  "rules": [
    {
      "rule_id": "RULE-INQUIRY-ANSWER",
      "priority": 10,
      "trigger": "EMPLOYEE/QUOTABLE로 승인된 가이드에 현재 문의와 직접 일치하는 안전한 조치가 있음",
      "agent_action": "근거와 중단 조건을 포함해 안내하고 사용자에게 실제 해결 여부를 확인한다.",
      "final_authority": "SPRING",
      "enforcement": "Spring은 접근 가능한 근거와 문의 버전을 검증하고 답변·해결 확인 상태를 저장한다.",
      "required_evidence": ["승인된 직원 가이드", "현재 문의 증상과 적용 조건의 일치"],
      "user_visible_behavior": "안전한 확인 순서와 미해결 시 다음 처리 방법을 보여 준다.",
      "prohibited_outcomes": ["사용자 확인 전 해결 완료", "STAFF 원문 인용", "근거 없는 해결 절차 생성"]
    },
    {
      "rule_id": "RULE-INQUIRY-DIAGNOSIS",
      "priority": 20,
      "trigger": "직원 가이드 근거가 부족하거나 안내 후 사용자가 미해결이라고 응답함",
      "agent_action": "기존 문제 문맥을 유지해 SUPPORT_DIAGNOSIS 또는 담당자 이관을 제안한다.",
      "final_authority": "SPRING",
      "enforcement": "Spring은 최신 문의 버전과 기존 티켓을 확인하고 전환 결과를 확정한다.",
      "required_evidence": ["검색 근거 부족 또는 미해결 응답", "기존 문의·문제 식별자"],
      "user_visible_behavior": "확인된 범위와 부족한 정보를 설명하고 진단 또는 이관 진행을 알린다.",
      "prohibited_outcomes": ["새 문의로 임의 분리", "해결됐다고 간주", "원인·부서 임의 확정"]
    },
    {
      "rule_id": "RULE-INQUIRY-QUESTIONS",
      "priority": 30,
      "trigger": "문제 분류나 부서 판단에 필요한 정보가 부족함",
      "agent_action": "문제별로 필요한 추가 질문을 하되 최대 3회 안에서 확인 가능한 사실만 요청한다.",
      "final_authority": "SPRING",
      "enforcement": "Spring은 문제별 질문 횟수와 최신 문의 버전을 저장·검증한다.",
      "required_evidence": ["누락된 필수 정보", "문제별 질문 횟수"],
      "user_visible_behavior": "왜 필요한지 알 수 있는 짧은 질문을 제공한다.",
      "prohibited_outcomes": ["3회를 넘는 반복 질문", "비밀번호·토큰·인증 코드 요구", "질문 횟수를 문의 전체에 잘못 합산"]
    },
    {
      "rule_id": "RULE-INQUIRY-MULTI",
      "priority": 40,
      "trigger": "한 문의에 서로 독립적인 문제가 둘 이상 포함됨",
      "agent_action": "문제를 처리 단위별로 분리하고 각 문제의 근거·상태·후보 부서를 독립적으로 제안한다.",
      "final_authority": "SPRING",
      "enforcement": "Spring은 문제와 티켓의 중복·멱등성·부분 성공을 검증하고 저장한다.",
      "required_evidence": ["서로 다른 증상·서비스 또는 처리 부서 근거"],
      "user_visible_behavior": "문제별 진행 상태와 생성된 티켓을 구분해 보여 준다.",
      "prohibited_outcomes": ["문제 하나로 강제 병합", "고정 티켓 수 상한", "한 문제 실패로 성공 티켓 취소"]
    },
    {
      "rule_id": "RULE-INQUIRY-OUT-OF-SCOPE",
      "priority": 50,
      "trigger": "IT 지원 범위 밖 질문으로 확인되거나 3회 질문 후에도 기술 문제로 분류할 수 없음",
      "agent_action": "범위 밖이면 안내만 제공하고, 분류 불가 IT 문의이면 CS 검토를 제안한다.",
      "final_authority": "SPRING",
      "enforcement": "Spring은 범위 밖과 CS 검토를 구분하고 불필요한 기술 티켓 생성을 차단한다.",
      "required_evidence": ["범위 판단 근거", "문제별 질문 횟수"],
      "user_visible_behavior": "처리할 수 없는 이유 또는 CS 검토 필요성을 설명한다.",
      "prohibited_outcomes": ["범위 밖 기술 티켓 생성", "모델 장애를 CS 분류로 처리", "임의 부서 배정"]
    }
  ],
  "prohibitions": ["Agent의 코드·설정·배포·재시작·DB 쓰기", "모델 문구만으로 해결·저장 성공 확정", "평가 정답 또는 숨겨진 원인을 답변 근거로 사용"],
  "related_artifacts": {
    "guide_ids": ["GUIDE-COMMON-INQUIRY-INFO", "GUIDE-COMMON-PROCESS", "GUIDE-COMMON-SCOPE"],
    "runbook_ids": [],
    "scenario_ids": ["FLOW-ANSWER-SOLVED", "FLOW-ANSWER-INSUFFICIENT", "FLOW-GUIDANCE-NOT-SOLVED", "FLOW-NO-EVIDENCE-HANDOFF", "FLOW-MULTI-PROBLEM", "FLOW-NO-WRITE-ACTION"]
  },
  "provenance": {"source_policy_ids": ["PRD-3.1", "PRD-3.2", "PRD-4.4", "DATA-INQUIRY"], "created_at": "2026-10-26"},
  "review": {"content_status": "OWNER_CONFIRMED", "reviewer": "DATA_OWNER", "reviewed_at": "2026-10-27", "team_review_status": "PENDING"}
}
