{
  "schema_version": "knowledge_policy.v0",
  "policy_id": "POLICY-CASE-LIFECYCLE",
  "version_no": 1,
  "title": "해결 확인·재오픈·CASE 생성과 재사용 규칙",
  "language": "ko",
  "status": "DRAFT",
  "document_type": "POLICY",
  "access": {"access_scope": "STAFF", "exposure_policy": "INTERNAL_ONLY", "ingest_status": "PENDING"},
  "purpose": "안내·담당자 조치·도구 성공과 실제 해결을 구분하고, 검증된 해결 기록만 CASE로 승격해 조건부 근거로 재사용한다.",
  "rules": [
    {
      "rule_id": "RULE-CASE-CONFIRM",
      "priority": 10,
      "trigger": "개별 티켓의 담당자 처리가 완료되었거나 처리 중 사용자가 먼저 해결을 알림",
      "agent_action": "개별 티켓의 해결을 단정하지 않고 사용자 해결 확인을 요청한다. 사용자가 먼저 해결을 알린 경우에는 담당자의 진행 작업 확인 결과를 함께 요약한다.",
      "final_authority": "SPRING",
      "enforcement": "Spring은 대상 문제·티켓, 담당자 처리 상태와 사용자 해결 확인을 검증해 개별 티켓 완료를 저장한다. 확인 대기 후 24시간 무응답이면 알림을 보내고 48시간 추가 무응답이면 미확인 종료하되 해결 완료나 AI 해결 실적으로 집계하지 않는다.",
      "required_evidence": ["대상 문제·티켓 식별자", "담당자 처리 완료 또는 사용자 선해결 신고에 대한 담당자 확인", "사용자 해결 확인"],
      "user_visible_behavior": "담당자 처리 후 실제로 해결됐는지 확인하고 미해결이면 해당 티켓 처리를 이어간다. 무응답 종료는 해결 완료와 구분해 표시한다.",
      "prohibited_outcomes": ["가이드 제공만으로 개별 티켓 완료", "Tool 성공이나 백엔드 정상 상태만으로 개별 티켓 완료", "사용자 확인 없는 개별 티켓 해결 완료", "검증된 동일 장애 그룹 밖 티켓의 일괄 완료"]
    },
    {
      "rule_id": "RULE-CASE-GROUP-COMPLETE",
      "priority": 15,
      "trigger": "Spring이 동일 장애 그룹으로 확정한 미완료 티켓들의 공통 장애를 그룹 담당자가 해결함",
      "agent_action": "공통 장애 근거, 그룹 담당자의 해결 기록과 대상 티켓 목록을 요약해 그룹 완료를 제안한다. 개별 사용자 사전 확인을 완료 조건으로 요구하지 않는다.",
      "final_authority": "SPRING",
      "enforcement": "Spring은 같은 처리 부서, 미완료 상태, 확정된 그룹 소속과 공통 조치로 함께 해결된다는 근거를 검증한 뒤 구성 티켓별 완료를 저장한다. 일부 반영 실패는 성공·실패 티켓을 구분하며 전체 성공으로 표시하지 않는다.",
      "required_evidence": ["확정된 장애 그룹 식별자와 구성 티켓 목록", "공통 장애와 공통 조치 근거", "그룹 담당자의 해결 기록"],
      "user_visible_behavior": "공통 장애가 해결되면 그룹 티켓을 완료하고, 이후 미해결을 알린 사용자의 티켓만 그룹에서 분리해 재오픈한다.",
      "prohibited_outcomes": ["문장 유사도만으로 그룹 완료", "그룹 밖 티켓 완료", "부분 실패를 전체 성공으로 표시", "한 사용자의 미해결 신고로 그룹 전체 재오픈"]
    },
    {
      "rule_id": "RULE-CASE-PROMOTE",
      "priority": 20,
      "trigger": "재현·담당자 조치·동일 조건 재시험·해결 확인이 모두 완료됨",
      "agent_action": "증상·관측·원인·반대 신호·조치·재시험·계보를 구조화한 CASE 후보를 제안한다.",
      "final_authority": "HUMAN",
      "enforcement": "데이터 담당자와 서비스 담당자가 비식별·검증 체크리스트를 확인한 뒤 VERIFIED로 승격한다.",
      "required_evidence": ["재현 시각·요청 ID", "마스킹된 관측값", "원인과 반대 신호", "사람 조치와 승인", "동일 조건 재시험", "해결 확인", "런북·Tool 버전"],
      "user_visible_behavior": "CASE 생성 여부는 직원 답변에 노출하지 않는다.",
      "prohibited_outcomes": ["추정 원인의 CASE 승격", "공개 문서의 티켓 형식 변환", "트리거 동작만 확인한 기록의 승격"]
    },
    {
      "rule_id": "RULE-CASE-RETRIEVE",
      "priority": 30,
      "trigger": "현재 문의와 유사한 VERIFIED CASE가 검색됨",
      "agent_action": "현재 Tool 관측과 CASE 필수·반대 신호를 비교하고 일치할 때만 후보 우선순위 보조 근거로 사용한다.",
      "final_authority": "SPRING",
      "enforcement": "Spring은 CASE 접근·활성 상태와 현재 관측 스냅샷 버전을 검증한다.",
      "required_evidence": ["VERIFIED·활성 CASE", "현재 Tool 관측", "연결 런북"],
      "user_visible_behavior": "유사 사례가 있더라도 현재 근거에 맞는 안내와 이관 이유만 제공한다.",
      "prohibited_outcomes": ["유사도만으로 원인 확정", "CASE와 충돌하는 현재 관측 무시", "다른 사용자의 식별 정보 노출"]
    },
    {
      "rule_id": "RULE-CASE-REOPEN",
      "priority": 40,
      "trigger": "완료된 문제가 해결되지 않았다고 재문의하거나 CASE 해결 검증이 취소됨",
      "agent_action": "기존 문제·티켓·CASE 연결을 유지한 재오픈 또는 검증 취소를 제안한다.",
      "final_authority": "SPRING",
      "enforcement": "Spring은 대상 티켓만 재오픈하고 관련 CASE를 검색 비활성화하며 이력을 보존한다.",
      "required_evidence": ["미해결 재문의", "기존 티켓·CASE 식별자"],
      "user_visible_behavior": "기존 처리 이력을 유지한 채 다시 점검한다고 안내한다.",
      "prohibited_outcomes": ["기존 이력 삭제", "그룹 전체 재오픈", "검증 취소 CASE의 계속 검색"]
    }
  ],
  "prohibitions": ["실제 해결되지 않은 합성 CASE 생성", "원시 SQL·내부 IP·개인정보·비밀값 보존", "단일 CASE를 보편 정답으로 사용", "pg_sleep 평가 트리거를 해결 CASE로 승격"],
  "related_artifacts": {
    "guide_ids": ["GUIDE-COMMON-PROCESS"],
    "runbook_ids": [],
    "scenario_ids": ["FLOW-ANSWER-SOLVED", "FLOW-CASE-MATCH", "FLOW-CASE-CONFLICT"]
  },
  "provenance": {"source_policy_ids": ["PRD-3.4", "PRD-3.5", "KNOWLEDGE-LIFECYCLE-6", "KNOWLEDGE-LIFECYCLE-7", "KNOWLEDGE-LIFECYCLE-8"], "created_at": "2026-10-26"},
  "review": {"content_status": "OWNER_CONFIRMED", "reviewer": "DATA_OWNER", "reviewed_at": "2026-10-27", "team_review_status": "PENDING"}
}
